{
  "$schema": "http://json-schema.org/draft-07/schema#",
  "title": "HarnessQualityManifest",
  "description": "Cross-phase quality handoff contract. Generated at P2 exit, updated at each Gate.",
  "type": "object",
  "required": ["schema_version", "generated_at_phase", "fr_ids", "gate_results"],
  "properties": {
    "schema_version": { "type": "string", "const": "1.0" },
    "generated_at_phase": { "type": "integer", "minimum": 1, "maximum": 8 },
    "fr_ids": {
      "type": "array",
      "items": { "type": "string", "pattern": "^FR-[0-9]{2,3}$" },
      "description": "All functional requirement IDs in scope"
    },
    "nfr_dimension_mapping": {
      "type": "object",
      "additionalProperties": { "type": "string" },
      "description": "NFR-ID -> harness dimension name (e.g. NFR-01 -> security)"
    },
    "nfr_fr_mapping": {
      "type": "object",
      "additionalProperties": {
        "type": "array",
        "items": { "type": "string" }
      },
      "description": "Reverse mapping: NFR-ID -> list of FR IDs that implement it (e.g. NFR-02 -> [FR-04, FR-05])"
    },
    "nfr_traceability": {
      "type": "object",
      "description": "NFR-ID -> {type, target, module} from SAD.md nfr_traceability block.",
      "additionalProperties": {
        "type": "object",
        "properties": {
          "type":   { "type": "string" },
          "target": { "type": "string" },
          "module": { "type": "string" }
        }
      }
    },
    "quality_targets": {
      "type": "object",
      "description": "SAB quality targets (min_coverage, max_complexity, p95_latency_ms, etc.) for context in gate prompts.",
      "additionalProperties": true
    },
    "fr_module_traceability": {
      "type": "object",
      "description": "FR-ID -> responsible module path from SAD.md fr_module_traceability block.",
      "additionalProperties": { "type": "string" }
    },
    "architecture_constraints": {
      "type": "array",
      "items": { "type": "string" },
      "description": "Constraints from SAD.md (e.g. No synchronous I/O in main thread)"
    },
    "high_risk_modules": {
      "type": "array",
      "items": { "type": "string" },
      "description": "File paths flagged as high-risk in SAD.md"
    },
    "gate_score_overrides": {
      "type": "object",
      "description": "Dimension-level threshold overrides auto-derived from quality_targets. Maps keys like min_coverage → test_coverage, max_complexity → complexity, p95_latency_ms → performance. Applied as a floor in finalize_gate().",
      "additionalProperties": { "type": "number" }
    },
    "gate_results": {
      "type": "object",
      "required": ["gate1", "gate2", "gate3", "gate4"],
      "properties": {
        "gate1": { "type": "object", "description": "Per-FR results map (fr_id -> result)" },
        "gate2": { "oneOf": [{ "type": "null" }, { "$ref": "#/$defs/gateResult" }] },
        "gate3": { "oneOf": [{ "type": "null" }, { "$ref": "#/$defs/gateResult" }] },
        "gate4": { "oneOf": [{ "type": "null" }, { "$ref": "#/$defs/gateResult" }] }
      }
    }
  },
  "$defs": {
    "gateResult": {
      "type": "object",
      "required": ["score", "quality_complete", "rounds_used"],
      "properties": {
        "score":            { "type": "number", "minimum": 0, "maximum": 100 },
        "quality_complete": { "type": "boolean" },
        "rounds_used":      { "type": "integer", "minimum": 1, "maximum": 3 },
        "open_critical":   { "type": "integer", "minimum": 0 },
        "open_high":       { "type": "integer", "minimum": 0 }
      }
    }
  }
}
